uuid,public_qid,strategy,generator,domain,difficulty,cognitive_dim,question_text,options,correct_answer,source_fact,answer_correct,distractors_plausible,not_ambiguous,source_faithful,needs_source,no_vague_language,difficulty_match,cognitive_match,notes
ef074428-4961-4ed6-8ee3-88284ac3089e,WB-BIZ-0051-L2,scenario_synthesis,claude,wine_business,2,synthesis,"A winemaker operating a small estate in the Slovak portion of the Tokaj region is preparing to bottle an aszú-style wine for export to the EU market. Her compliance officer notes that, although the estate lies across the border from the main Hungarian production zone, the vineyards fall within a historically protected district first delimited by royal decree in the 18th century. She wants to understand what production standards she must meet to legally label the wine as 'Tokaj' under current EU rules. Which of the following best describes her regulatory situation?","[{'id': 'A', 'text': 'Because the estate is in Slovakia, only Slovak national wine law applies, and Hungarian Tokaj standards are irrelevant to her labeling.'}, {'id': 'B', 'text': 'She may use the Tokaj name only if she exports exclusively to Hungary, since the cross-border designation is not recognized under EU legislation.'}, {'id': 'C', 'text': 'The 18th-century royal decree has been superseded entirely by EU legislation, so the historic district boundaries no longer affect which producers may use the Tokaj name.'}, {'id': 'D', 'text': 'The Tokaj region is recognized by the EU as spanning both Hungary and Slovakia, and the Slovak portion must adhere to the same standards established in Hungarian wine laws since 1990.'}]",D,Tokaj wine region was to introduce the same standards enshrined in Hungarian wine laws since 1990.,,,,,,,,,
790de202-bff7-41a9-9cf0-aed2a3c7c474,WB-PRD-0047-L3,comparative,llama,producers,3,analysis,A winery was established in Israel by a family who immigrated from England in the 1990s. This winery is located in which region?,"[{'id': 'A', 'text': 'Golan Heights Winery'}, {'id': 'B', 'text': 'Carmel Winery'}, {'id': 'C', 'text': 'Dalton Winery'}, {'id': 'D', 'text': 'Yarden Winery'}]",C,The Dalton Winery (Hebrew: יקב דלתון) was founded in 1995 by members of the Haruni family who moved to Israel from England.,,,,,,,,,
49c6d892-27bf-4e06-842d-7723d4d8922a,WB-GRP-0013-L2,template,template_only,grape_varieties,2,recall,Which country is considered the origin of the Malbec grape?,"[{'id': 'A', 'text': 'Spain'}, {'id': 'B', 'text': 'Argentina'}, {'id': 'C', 'text': 'New Zealand'}, {'id': 'D', 'text': 'Australia'}]",B,Malbec is a widely reviewed grape variety in Argentina.,,,,,,,,,
2726b50b-7b72-4bc1-8a27-0c54c56b74fc,WB-PRD-0027-L2,fact_to_question,claude,producers,2,recall,"Château Labégorce Zédé, formed from the historical estates of Château Labégorce-Margaux and Château Labégorce-Zédé, is located in which Médoc commune?","[{'id': 'A', 'text': 'Pauillac'}, {'id': 'B', 'text': 'Margaux'}, {'id': 'C', 'text': 'Saint-Estèphe'}, {'id': 'D', 'text': 'Saint-Julien'}]",B,Château Labégorce Zédé of what was formerly known separately as Château Labégorce-Margaux and Château Labégorce-Zédé lies in the commune of Margaux in the Médoc region in the département of Gironde.,,,,,,,,,
aeaf8ad0-7714-45d1-878a-c686adae8caf,WB-VIT-0028-L3,comparative,llama,viticulture,3,analysis,"Which AVA is characterized by predominantly rolling hills with sandy soils and contains a single large vineyard spanning 5,000 acres?","[{'id': 'A', 'text': 'Santa Lucia Highlands AVA'}, {'id': 'B', 'text': 'Santa Cruz Mountains AVA'}, {'id': 'C', 'text': 'Central Coast AVA'}, {'id': 'D', 'text': 'San Bernabe AVA'}]",D,"San Bernabe viticultural area encompasses 24,796 acres (39 sq mi) of
predominantly rolling hills with sandy soils with currently 5,000 acres (2,023 ha) of cultivation on its sole vineyard.",,,,,,,,,
eef82698-07eb-4951-aa03-36a2e832d36f,WB-GRP-0042-L3,comparative,llama,grape_varieties,3,analysis,A winemaker wants to produce a varietal Cabernet Franc and a varietal Chardonnay. Which AVA allows them to grow and label both as single-varietal wines?,"[{'id': 'A', 'text': 'North Coast AVA'}, {'id': 'B', 'text': 'Both Temecula Valley AVA and North Coast AVA'}, {'id': 'C', 'text': 'Temecula Valley AVA'}, {'id': 'D', 'text': 'Neither Temecula Valley AVA nor North Coast AVA'}]",D,Temecula Valley AVA permits the Cabernet Franc grape variety.,,,,,,,,,
50094bac-aaff-45b3-9d6f-08da28a5ad4d,WB-BIZ-0013-L2,fact_to_question,gemini,wine_business,2,recall,Which vintage of Dom Pérignon set the world auction record for a single lot of champagne and became the first HK$1 million lot of wine sold by Sotheby's?,"[{'id': 'A', 'text': '1990'}, {'id': 'B', 'text': '1996'}, {'id': 'C', 'text': '1992'}, {'id': 'D', 'text': '1988'}]",A,"Dom Pérignon 1990 achieved HK$1,331,000 (US$170,641), setting the world auction record for a single lot of champagne and is the first HK$1 million lot of wine Sotheby's has sold in.",,,,,,,,,
2164ca73-1e71-426e-8ec8-504d82daf946,WB-VIT-0074-L3,distractor_mining,qwen,viticulture,3,analysis,"Which vineyard practice, when intensified, has been shown to increase the number of buds retained on the vine to as many as 40, but also leads to a higher percentage of blind buds and reduced shoot length?","[{'id': 'A', 'text': 'Use of the Geneva double curtain trellis system'}, {'id': 'B', 'text': 'Leaf removal during canopy management'}, {'id': 'C', 'text': 'High bud count pruning'}, {'id': 'D', 'text': 'Extended maceration with wood chips from vine shoots'}]",C,"The Geneva double curtain or ""T"" trellis may be used for more vigorous cultivars.",,,,,,,,,
c76df7c6-fc23-4953-ae48-d144df8a4baf,WB-PRD-0080-L4,distractor_mining,gemini,producers,4,analysis,"While many German wine estates have historic underground facilities, one particular estate features a cellar whose appearance is uniquely reminiscent of a stalactite cave, though it remains ideally suited for wine storage. Which estate is this?","[{'id': 'A', 'text': 'Schloss Westerhaus'}, {'id': 'B', 'text': 'Karl Schaefer'}, {'id': 'C', 'text': 'Baron Knyphausen'}, {'id': 'D', 'text': 'Weingut Joh. Jos. Prüm'}]",A,"Prüm is a German wine grower and producer based in Bernkastel-Wehlen, in the wine-growing region of Mosel, Germany.",,,,,,,,,
da4c51b4-12c3-4886-879d-489ed52187ca,WB-VIT-0017-L2,fact_to_question,chatgpt,viticulture,2,recall,Which pair of grapevine phenological stages was highlighted as being commonly misclassified because of their visual similarity?,"[{'id': 'A', 'text': 'Fruit set and dormancy'}, {'id': 'B', 'text': 'Budburst and véraison'}, {'id': 'C', 'text': 'Flowering and harvest'}, {'id': 'D', 'text': 'Early shoot development and flowering'}]",D,"A confusion matrix analysis highlighted misclassification trends, particularly between early shoot development and flowering, due to their visual similarities.",,,,,,,,,
8d185dae-1e11-4339-b291-81ffd3002d23,WB-VIT-0011-L2,fact_to_question,gemini,viticulture,2,recall,"In pozzolanic soils, what causes calcium (Ca) and magnesium (Mg) to be less mobile?","[{'id': 'A', 'text': 'The excessive leaching of clay minerals'}, {'id': 'B', 'text': 'The minimal weathering of clinopyroxene'}, {'id': 'C', 'text': 'The high concentration of active limestone'}, {'id': 'D', 'text': 'The rapid decomposition of potassium feldspar'}]",B,"This indicates that in pozzolanic soils, Ca and Mg are less mobile due to the minimal weathering of clinopyroxene.",,,,,,,,,
fa8b067b-3f30-48b2-ae0a-908c0ba61dbb,WB-VIT-0042-L2,comparative,chatgpt,viticulture,2,analysis,"A student is trying to identify an AVA from field notes. The region is described not by its state or nearby city, but by a topographic profile that runs from alluvial fans and terraces above 350 feet to low-lying hills reaching about 800 feet. Which AVA best fits those notes?","[{'id': 'A', 'text': 'Both AVAs equally fit'}, {'id': 'B', 'text': 'San Lucas AVA'}, {'id': 'C', 'text': 'Sonoita AVA'}, {'id': 'D', 'text': 'Neither AVA fits'}]",B,Vineyards locations range from alluvial fans and terraces over 350 feet (107 m) above sea level to low-lying hills having maximal elevations of 800 feet (244 m) above sea level.,,,,,,,,,
1e438aca-17a5-45dd-af2d-957aaedf7ff0,WB-BIZ-0070-L4,distractor_mining,claude,wine_business,4,analysis,"Following Brexit and subsequent regulatory changes in the UK, this category of wine no longer requires labelling of geographical origin, and producers may now market examples with less than 8.5% alcohol by volume, including fully de-alcoholised versions. Which category is being described?","[{'id': 'A', 'text': 'English wine'}, {'id': 'B', 'text': 'English sparkling wine (protected PDO/PGI term)'}, {'id': 'C', 'text': 'Welsh Regional wine'}, {'id': 'D', 'text': 'Sussex wine'}]",A,"Since Brexit and law change, labelling of geographical origin is no more needed and it is possible to have wine with less than 8.5% of alcohol including wine without alcohol.",,,,,,,,,
0fe814b5-fab3-420b-b59e-060feb87f8be,WB-GRP-0064-L2,scenario_synthesis,claude,grape_varieties,2,synthesis,"An Israeli winery is planning the varietal mix for a new 40-hectare estate. The owners want the majority of plantings to reflect the country's most commercially established international varieties, with a smaller portion dedicated to varieties with local or niche significance. The winery also intends to produce a certified kosher bottling from at least one block. Which planting plan best fits these goals?","[{'id': 'A', 'text': 'Plant only Cabernet Sauvignon and Merlot across the entire estate, since kosher certification requires the exclusion of white varieties.'}, {'id': 'B', 'text': 'Devote equal area to Argaman and Cabernet Sauvignon, and ensure the kosher block is handled only by observant Jews from the moment of bottling onward.'}, {'id': 'C', 'text': 'Devote the majority to Argaman, Emerald Riesling, and Muscat of Alexandria, with a small block of Cabernet Sauvignon reserved for the kosher bottling handled only by observant Jews from crush onward.'}, {'id': 'D', 'text': 'Devote the majority to Cabernet Sauvignon, Chardonnay, Merlot, and Sauvignon Blanc, with smaller blocks of Emerald Riesling, Muscat of Alexandria, and Argaman; designate one of the major-variety blocks to be handled exclusively by observant Jews from crush onward for the kosher bottling.'}]",D,"Other varieties planted to some significant degree include Emerald Riesling, Muscat of Alexandria and the crossing Argaman.",,,,,,,,,
8ea13ce6-d4c9-42cf-8f52-cad63aebac5b,WB-REG-0010-L1,template,template_only,wine_regions,1,recall,Which country is the California wine region located in?,"[{'id': 'A', 'text': 'US'}, {'id': 'B', 'text': 'South Africa'}, {'id': 'C', 'text': 'France'}, {'id': 'D', 'text': 'New Zealand'}]",A,Bennett Valley is a wine-producing area within the California region of US.,,,,,,,,,
7339113e-eff7-4f98-aff6-a5845210ff6e,WB-WMK-0069-L4,distractor_mining,llama,winemaking,4,analysis,Which piece of equipment is needed to view yeast and bacteria at a magnification of 1000x?,"[{'id': 'A', 'text': 'Fermentation tank'}, {'id': 'B', 'text': 'SO2 tolerant control'}, {'id': 'C', 'text': 'Microscope'}, {'id': 'D', 'text': 'Cap management system'}]",C,"Overall, fermentation temperature had a more significant impact on the sensory and volatile composition of Pinot noir wines than the cap management regime.",,,,,,,,,
fd78a873-8a36-43ab-910a-a51a54f56dc7,WB-REG-0038-L2,fact_to_question,claude,wine_regions,2,recall,Clear Lake AVA is a sub-appellation contained within which larger California AVA?,"[{'id': 'A', 'text': 'North Coast AVA'}, {'id': 'B', 'text': 'Central Coast AVA'}, {'id': 'C', 'text': 'Northern Sonoma AVA'}, {'id': 'D', 'text': 'Sierra Foothills AVA'}]",A,Clear Lake AVA is located within the North Coast AVA.,,,,,,,,,
d1f44e4b-2645-4f4b-a48d-417c0c0ed987,WB-WMK-0068-L3,distractor_mining,llama,winemaking,3,analysis,Which winemaking technique results in decreased antioxidant potential and chemical stability due to reduced extraction of phenolic compounds in high-pH musts?,"[{'id': 'A', 'text': 'Short maceration period'}, {'id': 'B', 'text': 'Cation exchange to reduce pH'}, {'id': 'C', 'text': 'Extended maceration'}, {'id': 'D', 'text': 'Choline chloride:oxalic acid extraction'}]",A,"In particular, choline chloride:oxalic acid (1:1 at 40°C) emerged as the best one affording a total phenolic content of 43.0 mg/g (dry weight).",,,,,,,,,
6d6c9db4-d03f-4b9a-883e-43b637507bb9,WB-PRD-0013-L2,template,template_only,producers,2,recall,In which wine region is Castello Banfi located?,"[{'id': 'A', 'text': 'Pierre Gimonnet & Fils'}, {'id': 'B', 'text': 'Squerryes Estate'}, {'id': 'C', 'text': 'Tuscany'}, {'id': 'D', 'text': 'Wine of Origin'}]",C,Castello Banfi is a wine producer in the Tuscany region of Italy.,,,,,,,,,
122fa0f3-5b8e-4550-aa65-2949c10dbf99,WB-PRD-0026-L2,fact_to_question,claude,producers,2,recall,"South Africa's first official wine route was established in 1971 through the collaboration of Frans Malan of Simonsig, Spatz Sperling of Delheim, and Niel Joubert of Spier. In which wine region was this pioneering route founded?","[{'id': 'A', 'text': 'Stellenbosch'}, {'id': 'B', 'text': 'Franschhoek'}, {'id': 'C', 'text': 'Paarl'}, {'id': 'D', 'text': 'Constantia'}]",A,"In 1971, the first official wine route was founded by Frans Malan of Simonsig, Spatz Sperling of Delheim.",,,,,,,,,
d6cd8442-33ef-4bd6-a5e3-b36ab7e2fe64,WB-REG-0020-L3,template,template_only,wine_regions,3,recall,In which sub-region or parent region is Châteauneuf-du-Pape located?,"[{'id': 'A', 'text': 'Groenland mountains'}, {'id': 'B', 'text': 'Rhône Valley'}, {'id': 'C', 'text': 'Coastal Region'}, {'id': 'D', 'text': 'Sundarban Honey'}]",B,Châteauneuf-du-Pape is an AOC appellation in the Rhône Valley region of France.,,,,,,,,,
9902d898-58ef-4b4f-9820-967eb5898374,WB-PRD-0060-L4,scenario_synthesis,gemini,producers,4,synthesis,"A consulting enologist is designing a centralized grape-processing facility to serve a newly formed consortium of three estates: Bulgariana, Castra Rubra, and Domaine Boyar. To minimize oxidation and spoilage during transit, the facility must be centrally located within the specific geographical region where all three of these producers operate. Based on the location of these estates, where must the facility be built?","[{'id': 'A', 'text': 'Danubian Plain, Bulgaria'}, {'id': 'B', 'text': 'Struma River Valley, Bulgaria'}, {'id': 'C', 'text': 'Rose Valley, Bulgaria'}, {'id': 'D', 'text': 'Thracian Valley, Bulgaria'}]",D,Bulgariana is a wine producer in the Thracian Valley region of Bulgaria.,,,,,,,,,
13131981-3274-46a5-9d95-536d4b5186e1,WB-GRP-0048-L3,comparative,claude,grape_varieties,3,analysis,"A California winemaker is scouting AVAs for two separate projects: one focused on a structured, tannic red from Malbec, and another on a classic barrel-fermented Chardonnay. Given the grape varieties each AVA permits, which pairing correctly matches the project to the AVA?","[{'id': 'A', 'text': 'Both projects in Guenoc Valley AVA, which permits both varieties'}, {'id': 'B', 'text': 'Malbec project in Temecula Valley AVA; Chardonnay project in Guenoc Valley AVA'}, {'id': 'C', 'text': 'Malbec project in Guenoc Valley AVA; Chardonnay project in Temecula Valley AVA'}, {'id': 'D', 'text': 'Both projects in Temecula Valley AVA, which permits both varieties'}]",C,Guenoc Valley AVA permits the Malbec grape variety.,,,,,,,,,
a6778964-4784-409c-8c13-4ed80f8ba998,WB-BIZ-0054-L4,scenario_synthesis,chatgpt,wine_business,4,analysis,"A head winemaker at a French estate is planning the next vintage with the export director. The cellar can support either a larger volume line aimed at the single biggest wine-consuming market, or a smaller-volume prestige cuvée intended for the country profile that most strongly supports France's export value through high-priced categories such as Champagne, Bordeaux, and Burgundy. To align production with both market size and France's strongest value-export position, which market pairing should guide the two wines?","[{'id': 'A', 'text': 'Volume line for France; prestige cuvée for Italy'}, {'id': 'B', 'text': 'Volume line for the United States; prestige cuvée for France'}, {'id': 'C', 'text': 'Volume line for France; prestige cuvée for the United States'}, {'id': 'D', 'text': 'Volume line for Italy; prestige cuvée for the United States'}]",B,"France was the world's largest wine exporter by value in 2023, owing to high-value Champagne, Bordeaux, and Burgundy exports.",,,,,,,,,
d7b34436-3e68-4912-a574-e2702a36046d,WB-GRP-0068-L2,scenario_synthesis,chatgpt,grape_varieties,2,analysis,"A winemaker is finalizing a three-wine North Coast red program and is checking whether the planned varietal bottlings align with the permitted grapes for each sourcing area. The cellar plan shows: a Cabernet Franc from Mendocino County, a Cabernet Sauvignon from Kelsey Bench-Lake County AVA, and a Cabernet Sauvignon from Red Hills Lake County AVA. One assistant suggests changing one of these wines because they believe the grape is not permitted in its stated appellation. Based on the permitted varieties for these areas, what is the best decision?","[{'id': 'A', 'text': 'Change the Red Hills Lake County AVA wine because Cabernet Sauvignon is not permitted there.'}, {'id': 'B', 'text': 'Change the Kelsey Bench-Lake County AVA wine because Cabernet Sauvignon is not permitted there.'}, {'id': 'C', 'text': 'Keep all three wines as planned; each grape is permitted in its stated appellation.'}, {'id': 'D', 'text': 'Change the Mendocino County wine because Cabernet Franc is not permitted there.'}]",C,Mendocino County wine permits the Cabernet Franc grape variety.,,,,,,,,,
5965ce40-4a64-4840-823c-9cf8d1d61deb,WB-VIT-0054-L3,scenario_synthesis,gemini,viticulture,3,application,"A novice winemaker is evaluating a recent vintage by analyzing its five basic characteristics. They are satisfied with the wine's sweetness, acidity, body, and alcohol levels, but feel it lacks the fifth characteristic—a phenolic compound that experts note is often confusing to winemakers. To increase the extraction of this specific characteristic in the next batch, which of the following actions should the winemaker take?","[{'id': 'A', 'text': 'Increase the alcohol content to naturally synthesize this phenolic compound without skin contact.'}, {'id': 'B', 'text': ""Extend the juice's contact time with the grape seeds, skins, and stems during maceration.""}, {'id': 'C', 'text': 'Adjust the fermentation temperature to extract more of this compound exclusively from the grape pulp.'}, {'id': 'D', 'text': 'Press the grapes immediately after crushing to separate the juice from the seeds, skins, and stems.'}]",B,"Tannin , on the other hand, is a phenolic compound found in the seeds, skins, and stems of wine grapes.",,,,,,,,,
6bcea6b3-73cb-4886-8192-241e7cca54c5,WB-REG-0029-L2,fact_to_question,gemini,wine_regions,2,recall,In which Italian region is the Val di Cornia Rosso DOCG located?,"[{'id': 'A', 'text': 'Umbria'}, {'id': 'B', 'text': 'Marche'}, {'id': 'C', 'text': 'Piedmont'}, {'id': 'D', 'text': 'Tuscany'}]",D,Val di Cornia Rosso is a DOCG appellation in the Tuscany region of Italy.,,,,,,,,,
0f6cee62-ed35-4e7c-86df-dfe66f55827b,WB-VIT-0066-L4,distractor_mining,llama,viticulture,4,analysis,A wine producer evaluating vineyard expansion opportunities in Georgia in 1985 is presented with these acreage figures — which one corresponds to the total vineyard area in Georgia at that time?,"[{'id': 'A', 'text': '3,700 acres'}, {'id': 'B', 'text': '143,000 acres'}, {'id': 'C', 'text': '15 km2'}, {'id': 'D', 'text': '316,000 acres'}]",D,"In 1950, vineyards in Georgia occupied 143,000 acres, but by 1985 this had reached 316,000 acres due to an increase in demand.",,,,,,,,,
75b86964-8f81-49cc-8d71-1c6dee43151f,WB-BIZ-0030-L2,comparative,gemini,wine_business,2,analysis,"A sommelier is analyzing the median market pricing of regional blends to balance a wine list's budget. When comparing a Red Blend from Piedmont to a White Blend from Washington, what pricing relationship should they expect?","[{'id': 'A', 'text': 'Both blend categories share an identical median price of $18, reflecting standard entry-level pricing for regional blends.'}, {'id': 'B', 'text': 'The Washington White Blend commands a higher median price ($30) than the Piedmont Red Blend ($18).'}, {'id': 'C', 'text': 'The Piedmont Red Blend commands a higher median price ($30) than the Washington White Blend ($18).'}, {'id': 'D', 'text': 'Both blend categories share an identical median price of $30, reflecting a standard premium for these styles.'}]",C,White Blend wines from Washington have a median price of $18.,,,,,,,,,
2cd4411b-33c2-470e-817c-a62dcedb3271,WB-REG-0011-L1,template,template_only,wine_regions,1,recall,Which country is the Neusiedlersee wine region located in?,"[{'id': 'A', 'text': 'Australia'}, {'id': 'B', 'text': 'New Zealand'}, {'id': 'C', 'text': 'South Africa'}, {'id': 'D', 'text': 'Austria'}]",D,The most widely reviewed variety in Neusiedlersee is Zweigelt.,,,,,,,,,
ae0cdf8e-3d38-44b6-ac92-8ac051068887,WB-PRD-0062-L4,scenario_synthesis,gemini,producers,4,application,"During the harvest season, an executive winemaker is coordinating crush logistics for a newly formed Argentine wine group that has acquired Bodega Norton, Salentein, and Michel Torino. To optimize fermentation space and minimize transport times, the winemaker mandates that all fruit originating from producers in the Mendoza Province region must be processed at the group's central Mendoza crush pad. Meanwhile, fruit from producers located in the 'Other' region of Argentina will be routed to a separate facility. Based on the geographic locations of these producers, which processing plan must the winemaker implement?","[{'id': 'A', 'text': 'Route Salentein and Michel Torino to the central Mendoza crush pad, and Bodega Norton to the separate facility.'}, {'id': 'B', 'text': 'Route Bodega Norton and Michel Torino to the central Mendoza crush pad, and Salentein to the separate facility.'}, {'id': 'C', 'text': 'Route Michel Torino to the central Mendoza crush pad, and both Bodega Norton and Salentein to the separate facility.'}, {'id': 'D', 'text': 'Route Bodega Norton and Salentein to the central Mendoza crush pad, and Michel Torino to the separate facility.'}]",D,Michel Torino is a wine producer in the Other region of Argentina.,,,,,,,,,
bc360bbe-b4f2-4a96-951f-25e9e4161f06,WB-GRP-0060-L4,scenario_synthesis,gemini,grape_varieties,4,application,"An Australian winemaker is processing a historic red grape variety that was introduced in the 18th century and was once the country's most widely planted red grape. The fruit was harvested very ripe, producing a sweet juice with a jam-like consistency. Given the specific vulnerabilities of this variety, which winemaking approach should be prioritized?","[{'id': 'A', 'text': 'Encouraging deliberate oxidative handling to reduce the jam-like sweetness and enhance its naturally stable color.'}, {'id': 'B', 'text': 'Employing aggressive micro-oxygenation to stabilize its naturally deep, dark pigmentation and soften its high tannins.'}, {'id': 'C', 'text': 'Withholding sulfur dioxide additions to allow the sweet juice to naturally polymerize its robust anthocyanins.'}, {'id': 'D', 'text': 'Utilizing inert gas blanketing during pump-overs to protect against its high susceptibility to oxidation and color loss.'}]",D,Grenache was one of the first varieties to be introduced to Australia in the 18th century and eventually became the country's most widely planted red wine grape variety until it.,,,,,,,,,
d5fd9df9-8db0-4003-8156-6247c24ac03e,WB-VIT-0035-L2,comparative,qwen,viticulture,2,analysis,"A winegrower is presenting a petition to establish a new viticultural area in California, emphasizing its distinct geographic identity and potential for premium winegrowing. The proposed region is not yet officially recognized but is being put forward by a local producer aiming to highlight the area’s unique terroir. Which of the following AVAs best matches this scenario?","[{'id': 'A', 'text': 'Santa Lucia Highlands AVA'}, {'id': 'B', 'text': 'Malibu-Newton Canyon AVA'}, {'id': 'C', 'text': 'Cole Ranch AVA'}, {'id': 'D', 'text': 'Edna Valley Vineyard AVA'}]",A,"Barry Jackson of the Harmony Wine Company proposing a viticultural area to be known as ""Santa Lucia Highlands.",,,,,,,,,
4525f527-2cab-4624-9a52-a6e1bdf39935,WB-WMK-0025-L2,fact_to_question,chatgpt,winemaking,2,recall,"For these Bordeaux wines, what bottle-ageing period is said to enhance their depth and complexity, even though they can be enjoyed young?","[{'id': 'A', 'text': '5 to 10 years'}, {'id': 'B', 'text': '8 to 15 years'}, {'id': 'C', 'text': '12 to 20 years'}, {'id': 'D', 'text': '2 to 4 years'}]",A,"Absolutely. These wines can be enjoyed young, but ageing 5 to 10 years will only enhance their depth and complexity.",,,,,,,,,
a3d0ac35-cbb6-43e2-8f1c-7591218a5443,WB-REG-0009-L1,template,template_only,wine_regions,1,recall,Which country is the Rheingau wine region located in?,"[{'id': 'A', 'text': 'US'}, {'id': 'B', 'text': 'Spain'}, {'id': 'C', 'text': 'South Africa'}, {'id': 'D', 'text': 'Germany'}]",D,The most widely reviewed variety in Rheingau is Riesling.,,,,,,,,,
